{
  "authoredIndependently" : true,
  "building" : {
    "chimney" : {
      "dimensions" : [
        4,
        8,
        4
      ],
      "materialID" : "chimney-terracotta",
      "positionWorld" : [
        -18,
        69,
        10
      ]
    },
    "depth" : 56,
    "floorHeight" : 11.5,
    "floors" : 5,
    "foundationHeight" : 3,
    "foundationMaterialID" : "foundation-stone",
    "massBlocks" : [
      {
        "dimensions" : [
          18,
          60,
          50
        ],
        "id" : "l03-west-courtyard-wing",
        "materialID" : "brick-terracotta-deep",
        "positionWorld" : [
          -18,
          33,
          0
        ]
      },
      {
        "dimensions" : [
          18,
          60,
          50
        ],
        "id" : "l03-east-courtyard-wing",
        "materialID" : "brick-terracotta-deep",
        "positionWorld" : [
          18,
          33,
          0
        ]
      },
      {
        "dimensions" : [
          36,
          48,
          18
        ],
        "id" : "l03-lower-north-bridge",
        "materialID" : "stone-honey",
        "positionWorld" : [
          0,
          27,
          -16
        ]
      }
    ],
    "massingProfile" : "stepped-u-courtyard-midrise",
    "roofHeight" : 6,
    "roofMaterialID" : "slate-charcoal",
    "roofOverhang" : 1.5,
    "roofVolumes" : [
      {
        "dimensions" : [
          20,
          5,
          52
        ],
        "id" : "l03-west-wing-parapet",
        "materialID" : "slate-charcoal",
        "positionWorld" : [
          -18,
          65.5,
          0
        ],
        "shape" : "flat-parapet",
        "trimMaterialID" : "limestone-warm"
      },
      {
        "dimensions" : [
          20,
          5,
          52
        ],
        "id" : "l03-east-wing-parapet",
        "materialID" : "slate-charcoal",
        "positionWorld" : [
          18,
          65.5,
          0
        ],
        "shape" : "flat-parapet",
        "trimMaterialID" : "limestone-warm"
      },
      {
        "dimensions" : [
          38,
          5,
          20
        ],
        "id" : "l03-bridge-parapet",
        "materialID" : "roof-green",
        "positionWorld" : [
          0,
          53.5,
          -16
        ],
        "shape" : "flat-parapet",
        "trimMaterialID" : "limestone-warm"
      }
    ],
    "trimBands" : [
      {
        "dimensions" : [
          55,
          0.90000000000000002,
          51
        ],
        "id" : "l03-first-string",
        "materialID" : "limestone-warm",
        "positionWorld" : [
          0,
          14.5,
          0
        ]
      },
      {
        "dimensions" : [
          55,
          1.1000000000000001,
          51
        ],
        "id" : "l03-third-string",
        "materialID" : "limestone-warm",
        "positionWorld" : [
          0,
          37.5,
          0
        ]
      },
      {
        "dimensions" : [
          55,
          1.3999999999999999,
          51
        ],
        "id" : "l03-cornice-string",
        "materialID" : "limestone-warm",
        "positionWorld" : [
          0,
          61.5,
          0
        ]
      }
    ],
    "trimMaterialID" : "limestone-warm",
    "usesLegacyDomesticDetails" : false,
    "wallHeight" : 64,
    "wallMaterialID" : "brick-terracotta-deep",
    "width" : 56
  },
  "camera" : {
    "elevationDegrees" : 30,
    "orthographicScale" : 203.64675298172568,
    "oversamplingFactor" : 4,
    "positionWorld" : [
      180,
      146.9693845669907,
      180
    ],
    "postProjectionOffsetPixels" : [
      0,
      256
    ],
    "projection" : "orthographic-2:1",
    "renderViewportPixels" : [
      1536,
      1024
    ],
    "sourceGroundCenter" : [
      768,
      768
    ],
    "targetWorld" : [
      0,
      0,
      0
    ],
    "yawDegrees" : 45
  },
  "derivation" : {
    "mirror" : false,
    "rotationDegrees" : 0,
    "siblingSource" : null,
    "sourceKind" : "independent-scene-description",
    "transform" : "none"
  },
  "entrance" : {
    "baseWorld" : [
      -28,
      3,
      0
    ],
    "canopyDepth" : 20,
    "depth" : 2.3999999999999999,
    "doorMaterialID" : "door-deep-green",
    "facadeID" : "west-facade",
    "height" : 15,
    "hingeSide" : "right",
    "pavilionDepth" : 8,
    "pavilionHeight" : 24,
    "pavilionMaterialID" : "stone-honey",
    "pavilionRoofHeight" : 5,
    "pavilionWidth" : 22,
    "porchColumnWidth" : 1.8,
    "porchLateralOffset" : 12,
    "porchWidth" : 27,
    "stepCount" : 5,
    "stepRun" : 2.2000000000000002,
    "style" : "courtyard-portal",
    "surroundMaterialID" : "limestone-warm",
    "width" : 12
  },
  "facades" : [
    {
      "direction" : "north",
      "edgeWorld" : [
        [
          -28,
          -28
        ],
        [
          28,
          -28
        ]
      ],
      "hasEntrance" : false,
      "id" : "north-facade",
      "materialID" : "brick-ochre",
      "windowBays" : [

      ],
      "windowRhythms" : [
        {
          "centersWorld" : [
            [
              -16,
              10.5,
              -25.199999999999999
            ],
            [
              16,
              10.5,
              -25.199999999999999
            ]
          ],
          "floor" : 1,
          "height" : 8.5,
          "id" : "n-f1-pairs",
          "materialID" : "window-warm",
          "sillHeight" : 4,
          "width" : 7
        },
        {
          "centersWorld" : [
            [
              -16,
              23,
              -25.199999999999999
            ],
            [
              0,
              23,
              -25.199999999999999
            ],
            [
              16,
              23,
              -25.199999999999999
            ]
          ],
          "floor" : 2,
          "height" : 8.5,
          "id" : "n-f2-triplet",
          "materialID" : "window-warm",
          "sillHeight" : 4,
          "width" : 7
        },
        {
          "centersWorld" : [
            [
              -16,
              33.5,
              -25.199999999999999
            ],
            [
              0,
              33.5,
              -25.199999999999999
            ],
            [
              16,
              33.5,
              -25.199999999999999
            ]
          ],
          "floor" : 3,
          "height" : 8,
          "id" : "n-f3-triplet",
          "materialID" : "window-warm",
          "sillHeight" : 3.5,
          "width" : 6.5
        },
        {
          "centersWorld" : [
            [
              -16,
              45,
              -25.199999999999999
            ],
            [
              0,
              45,
              -25.199999999999999
            ],
            [
              16,
              45,
              -25.199999999999999
            ]
          ],
          "floor" : 4,
          "height" : 8,
          "id" : "n-f4-triplet",
          "materialID" : "window-warm",
          "sillHeight" : 3.5,
          "width" : 6.5
        },
        {
          "centersWorld" : [
            [
              -16,
              56.5,
              -25.199999999999999
            ],
            [
              16,
              56.5,
              -25.199999999999999
            ]
          ],
          "floor" : 5,
          "height" : 8,
          "id" : "n-f5-pairs",
          "materialID" : "window-warm",
          "sillHeight" : 3.5,
          "width" : 6.5
        }
      ]
    },
    {
      "direction" : "east",
      "edgeWorld" : [
        [
          28,
          -28
        ],
        [
          28,
          28
        ]
      ],
      "hasEntrance" : false,
      "id" : "east-facade",
      "materialID" : "brick-ochre",
      "windowBays" : [

      ],
      "windowRhythms" : [
        {
          "centersWorld" : [
            [
              25.199999999999999,
              10.5,
              -16
            ],
            [
              25.199999999999999,
              10.5,
              0
            ],
            [
              25.199999999999999,
              10.5,
              16
            ]
          ],
          "floor" : 1,
          "height" : 8.5,
          "id" : "e-f1-triplet",
          "materialID" : "window-warm",
          "sillHeight" : 4,
          "width" : 7
        },
        {
          "centersWorld" : [
            [
              25.199999999999999,
              23,
              -16
            ],
            [
              25.199999999999999,
              23,
              0
            ],
            [
              25.199999999999999,
              23,
              16
            ]
          ],
          "floor" : 2,
          "height" : 8.5,
          "id" : "e-f2-triplet",
          "materialID" : "window-warm",
          "sillHeight" : 4,
          "width" : 7
        },
        {
          "centersWorld" : [
            [
              27.199999999999999,
              33.5,
              -16
            ],
            [
              27.199999999999999,
              33.5,
              0
            ],
            [
              27.199999999999999,
              33.5,
              16
            ]
          ],
          "floor" : 3,
          "height" : 8,
          "id" : "e-f3-triplet",
          "materialID" : "window-warm",
          "sillHeight" : 3.5,
          "width" : 6.5
        },
        {
          "centersWorld" : [
            [
              27.199999999999999,
              45,
              -16
            ],
            [
              27.199999999999999,
              45,
              0
            ],
            [
              27.199999999999999,
              45,
              16
            ]
          ],
          "floor" : 4,
          "height" : 8,
          "id" : "e-f4-triplet",
          "materialID" : "window-warm",
          "sillHeight" : 3.5,
          "width" : 6.5
        },
        {
          "centersWorld" : [
            [